Level,Recommendations
psv,encourage faculty members to finish their masters degrees
psv,orientation programs are to be held for newly hired employees and faculty members
psv,inservice training for faculty members should be regularly held say once every semester
psv,update syllabi to include more recent references and topics among others also include the semester and school year when the syllabi are prepared
psv,faculty members are encouraged to prepare instructional materials and if possible they must be copyrighted if they will be sold to students they must be coursed through an office or any entity in the institution where it can be part of the income generating project of the department if there is still no entity or office to do this the mmsu can look into other colleges and universities who are already doing this
psv,a mechanism can also be devised to monitor the attendance of faculty members eg a logbook can be designed to properly monitor the attendance of the faculty members in their classes
psv,properly classify and arrange documents according to benchmark statements of the survey instrument package the documents in a manner that can be looked into easily
psv,encourage faculty members to attend seminarstraining etc to hone further their teaching capabilities
psv,attach pictures that prove activities participated in by the faculty members eg extension activities faculty gatherings and other activities etc
