Level,Recommendations
psv,a distinct research office furnished with amenities necessary in the conduct of researches may be established
psv,an inhouse review of ongoing and completed researches be conducted at the college level before the university level to monitor as well as evaluate the researches
psv,each faculty researcher may prepare an action plan at the start of the school year to monitor the progress of the conducted researches
psv,a department research journal may be published
psv,encourage all the faculty members in the department to get involved in research work
psv,a seminar on ipr laws may be conducted to be attended by faculty and students
psv,strengthen linkages with local regional and national agencies which are potential sources of funding
