Level,Recommendations
1,to ensure safe keeping of donated laboratory equipment a memorandum receipt be issued to end users
1,the administration may consider to schedule the conduct of training on the repair and maintenance of high end equipmentapparatus
1,the administration may prioritize the construction of additional stock room for supplies
1,to maximize the efficiency of the state of the art equipment and apparatus proper handling and safekeeping is necessary
1,modification of laboratory rooms might be taken into consideration to accommodate additional equipment for the laboratory work and instruction
1,the repair of the existing cabinets may be considered for the safe keeping of the materials and apparatus in the laboratory rooms
