Level,Recommendations
3,institution revisit faculty workload conform guideline class size reduce class size meet program requirement lecture class laboratory class
3,faculty workload format revise reflect not_only teach load also time allotment academicrelated activity preparation lesson evaluation record student quiz output research extension activity scholarly work state faculty workload guideline
3,faculty development program include attendance faculty seminar training update current trend field specialization
3,institution consider give incentive faculty encourage present paper national international conference aside transportation allowance registration fee subsidy
3,faculty encourage publish paper refer journal train repackage research publishable format
3,institution give incentive faculty encourage develop instructional material
3,course syllabus include semester school year update not_only format also course content topic
