Level,Recommendations
4,suggest director library implement activation personal data clientele system management acquire security antenna make integrate library system functional
4,suggest furniture shelf refurbish enliven area aesthetic reason
4,necessary library director acquire follow efficiency adequacy service filipiniana book b airconditioning unit
4,also recommend collection old edition book weed regularly make relevant trend time addition sustain purchase professional book late edition adequacy research work
4,encoder resource integrate library system focus task able encode available resource easy retrieval material stakeholder
4,keep add best practice enhance teachinglearning process
