Level,Recommendations
3,calibration laboratory equipmentapparatus reflect inventory list duly sign laboratory incharge concerned personnel
3,maintenance team andor laboratory incharge shall ensure laboratory equipment functional
3,program continue modernization upgrade instructional laboratory facility equipment formulate
3,annual training program laboratory operation safety provide student faculty staff
3,laboratory manual catalog reference make available inside laboratory room
3,substantial update properly sign document present
