Level,Recommendations
2,intensify documentation process formulation review research agenda program participation various stakeholder internal external expect must fully note
2,administration exert effort encourage core faculty program productive research incentive package beneficial researcher make attractive flexible
2,possible establish linkage intemational organization japan society promotional science jsps funding support assistance specifically research development
2,utilization research output institutional development improvement instruction extension purpose must fully document
2,moaterminal report update make available upon completion project
