Level,Recommendations
1,fund warrant university install additional light system repair replace defective electric fan
1,safety precautionary measure print readable post visibly
1,fire extinguisher suggest place conspicuous place accessibility
1,encourage laboratory room shop provide first aid cabinet medicine post antidote chart
1,management schedule regular conduct fire earthquake drill
1,department apply principle put thing order
1,possible laboratory technician hire faculty focus instruction function
1,ece department consider provide tool room different laboratory equipment give space student perform laboratory activity
1,budget permit college consider purchasing additional laboratory equipment meet minimum requirement set ched
