Level,Recommendations
1,psychometrician important personnel university order function efficientlyeffectively assistant assign university
1,need constantly update exist manual info material alumnus checklist directory necessarily order disseminate late information program easy retrieval reference alumnus
1,database enrolment monitoring evaluation student activity put exhibit hence project pursue
1,dean member faculty could include major equipment need program include item preparation approval annual procurement program
1,active involvement alumnus tapped dean student alumnus could provide strong support term funding information base student
1,research employability demand analysis graduate initiate combine effort student guidance support dean member faculty
1,constant dialogue dean faculty student initiate order foster build open line communication among thereby identify worthy project activity program college
