Level,Recommendations
2,improve integrity thesesresearch paper strengthen defense process expert service external evaluator sought dean per recommendation department chair thesis adviser honorarium however increase additional fee give compensate effort cover expense include not_limited gasoline food also thesesresearch paper subject plagiarism grammar check
2,need periodically review curriculum meet exigency time undertaking however require involvement entire academic community include alumnus representative industry ensure academe time demand industry likewise proper documentation observe ie letter invitation attendance sheet minute proceeding picture among others include among document
2,faculty member encourage preparedevelop book instructional material respective subject evaluatedreviewed highly competent expert observe rigid standard protocol include copyright
2,age modern technology everyone internet facility faculty member venture develop caitype computeraidedinstruction module learn package also consider expose student often various academic pursuit lakbayaral exposure trip national conference forum cooperative different topic related course relatedundertaking hence teachinglearning process enjoyable interest part faculty member student
2,conduct seminarworkshop training test construction measurement evaluation test result base properly formulate table specification require workshop output include critique edit test administer also suggest
2,prioritize creation consortiapartnerships networkinglinkages academic high education institution end view provide access instructional material journal likewise consider networking national international linkage take advantage internet e communication collaborative effort faculty member alumnus connection respective workplacesorganizations linkage however document support memorandum agreement
2,student membership recognize organization national international must give attention
2,encourage faculty member graduate student engage collaborative research fund university funding agency however base university college priority beneficial entire academic community
2,conduct indepth study productivity faculty member academic performance graduate student level success graduate serve mechanism gathering feedback stakeholder improve operation management college
2,support document evidence every item complete systematically arrange neatly package
