Level,Recommendations
2,system formulate revise disseminate program goal objective adopt make functional college level
2,consistency congruence program goal objective vision mission make evident
2,knowledge skill attitude expect graduate institution likewise cascade course objective specific measurable attainable result orient timespecific smart
2,wider participation concerned group stakeholder evidence dissemination acceptance far enhance
2,mode determine quantify level awareness acceptability explore
