Level,Recommendations
3,faculty biology mathematics involve research extension activity
3,one hundred percent biology mathematics professor develop instructional material workbook module etc instructional material prepared beautifully
3,member accreditation task force check carefully survey instrument previous present evaluation avoid inconsistency
3,system filing document alright still room improvement
3,document every area properly sign concerned signatory
3,faculty biology mathematics become member least one scientific organization honor society
