Level,Recommendations
2,substitution mechanism fill leaf absencevacancies occur school year avoid interruption class suggest
2,clear definite policy fairly compensate faculty member conduct research extension establish
2,observance exist guideline teach load number preparation faculty member give way quality instruction related task recommend
2,list reference review include book recent edition currently available library
2,production material quality instruction evaluate ims committee want
2,effective utilization time schedule assignment research extension consultation must incorporate teacher program
2,maintain sustainable faculty development program suggest budget allocation increase
2,quality instruction effective classroom management suggest faculty load accordance program requirement
