Level,Recommendations
2,precautionary safety measure antidote chart displayed every laboratory
2,medicine cabinet properly mount enough first aid medicine material
2,hostel laboratory tourism management particularly travel agency management course equip global distribution system go b printer c counter fixture tarpaulin travel bureau paraphernalia
2,university fasttrack refurbishment food laboratory building cbea compound
2,university consider update refurbishment speech laboratory make functional
2,faculty member encourage develop laboratory manual tourism course manual submit university instructional committee evaluation quality manual developed submit copyright
2,present file clear properly sign document need color picture prefer break picture
