Level,Recommendations
2,enhance library services which offer online public access catalog opac to provide a better and faster access to library resources and to facilitate effective and efficient services to its usersclientele
2,a comprehensive library manual that covers the whole operation of the library and should be duly approved and widely disseminated
2,acquisition of library resources in all formats printnonprint and electronic digital resources of recent copy right in the general references and major field of specialization for the different programs being evaluated as well as professional journals and magazines to at least titles locally and internationally publication is highly recommended
2,if badget warrants install more air condition units electric fans in some sections areas in the library for better ventilation conductive for learning
2,prepare and develop library newsletter whuch promotes and disseminates librarys latest acquisitions programs and accomplishment of the library
