Level,Recommendations
3,the core collection with current edition of book and other material may be continuously enhance
3,the number of volume of the collection per curricular need to conform with the standard set forth in academic program may be increase
3,a library integrate system that generates all the necessary service and facilitates the organization of the resource may be consider
3,the administration may consider instal a security and monitoring system such as cctv door detector and concave mirror
3,an additional airconditioning unit may be instal in the reading area of the library to make the place more conducive to learn
