Level,Recommendations
4,the building floor plan may be displayed or post in conspicuous place in the building
4,signage of entry and exit in the first floor and second floor of the building may be make available and visible
4,more fire extinguisher may be mount and be accessible in the building firefighting equipment like fire hose may be make available in the building of the college
4,pest control inspection may be do periodically
4,trash bin may be more available in the corridor and classroom antilittering campaign may be implement to maintain cleanliness of the classroom and surroundings
4,pathway intend for person with disability pwd may have the railing
4,student may be give responsibility in the maintenance and beautification of classroom
4,lounge in the faculty room may be make available
