Level,Recommendations
2,intensify the documentation process in the formulation and review of the research agenda of the program participation of various stakeholder both internal and external will be expect and must be fully note
2,the administration may exert more effort to encourage the core faculty of the program to be more productive in research incentive and other package beneficial to the researcher may be make more attractive and flexible
2,if possible establish linkage with intemational organization like japan society for the promotional science jsps for funding support and assistance specifically for research and development
2,utilization of research output for institutional development improvement of instruction and extension purpose must be fully document
2,moaterminal report should be update and make available upon completion of the project
