Level,Recommendations
1,combine class with more than fifty student per class into two section to meet the ched facultystudent ratio requirement
1,review the provision on faculty workload assignment for revision beneficial to both faculty member and administrative official may conform
1,faculty should be encourage to produce instructional material base on relevant research finding and knowledge for production with royalty to be provide to the proponent as incentive
1,encourage more faculty to do more scholarly work to be present to national and international conference this could be do by provide monetary incentive and service credit on top of deloading from their full time teach equivalent to compensate research extension and production activity increase the size of faculty room to give amp space for faculty in do their basic task and duty comfortably
1,purchase additional unit of laptop and multimedia equipment to improve the teach method and technique for an effective teachinglearning environment
1,devise a monitoring system in the college to ensure punctuality of faculty in attend their class and univer ity activity
1,faculty may be encourage to join and participate in scientific organization or honor society relevant to their field of specialization
1,additional classroom should be provide to eliminate conflict of schedule among faculty and to ensure prompt performance of duty
1,frequent dialogue among faculty member and administrator may be initiate to create an atmosphere of open communication and establish harmonious relationship
