Level,Recommendations
3,approval of the operation manual by the board of regent before it publication is necessary
3,make the record management of the college fully functional
3,encouragement motivation of each depertment to implement it own income generate project may be undertaken to add income to the college
3,increase participation of student in planning and decisionmaking activity of college is also encourage
3,the proper filing system be strictly implement to reduce waste of time effort material and expense is encourage
