Level,Recommendations
3,the institution may revisit it faculty workload to conform to the guideline as to class size or reduce the class size to meet the program requirement of for lecture class and for laboratory class
3,the faculty workload format may be revise to reflect not_only the teach load but also the time allotment for other academicrelated activity such as preparation of the lesson evaluation and record of student quiz and output research and extension activity and scholarly work as state in the faculty workload guideline
3,the faculty development program may include attendance of faculty in seminar and training to update themselves on current trend in their field of specialization
3,the institution may consider give incentive to faculty to encourage them to present paper in national and international conference aside transportation allowance and registration fee subsidy
3,faculty may be encourage to publish their paper in refer journal and they may be train to repackage research in publishable format
3,the institution may give incentive to faculty to encourage them to develop instructional material
3,the course syllabus may should include the semester and school year use and the update may not_only be in the format but also in the course content or topic
