Level,Recommendations
2,additional guidance counselor may be hire so as to meet counselorstudent ratio as stipulate in the ched policy
2,the revise and enrich university guidance manual should be submit for approval by the board of regent
2,the university may provide an ideal space for guidance and counsel equip with the necessary amenity to project a cozy and appeal atmosphere for student who come for counsel
2,revisit the organizational structure of the ssdo indicate clearly the line of coordination in some unit
2,rule and regulation for both the male and female dormitory may be post in conspicuous place
