Level,Recommendations
2,to ensure safe keep of donate laboratory equipment memorandum receipt be issue to end user
2,the administration may consider to conduct seminar and training for faculty and staff on maintenance and proper care of equipmentapparatus
2,the administration may prioritize the construction of additional stock room for supply and equipment in the laboratory
2,to maximize the efficiency of the state of the art equipment and apparatus proper handle and safekeeping is necessary
2,modification of laboratory room might be take into consideration to accommodate additional equipment
2,immediate purchase of the additional material and equipment need by the program base on cmo guideline is greatly encourage
