Level ,Recommendations
2,precautionary and safety measure and antidote chart be displayed in every laboratory
2,medicine cabinet be properly mount with enough first aid medicine and material
2,the university may fasttrack the refurbishment of the food laboratory building at the cbea compound
2,the university may consider the update and refurbishment of the speech laboratory to make it functional
2,present and file clear and properly sign document if need be color picture be prefer over black and white print
