Level,Recommendations
1,the psychometrician is an important personnel of the university in order for her to function efficientlyeffectively an assistant may be assign by the university
1,there is a need to constantly update exist manual and other info material as well as alumnus checklist and directory this is necessarily in order to disseminate the late information about the program and for easy retrieval or reference about the alumnus
1,database on enrolment and monitoring and evaluation of student activity be put of the exhibit hence they be project that should be pursue
1,the dean and member of the faculty could include major equipment need of the program by include these item in the preparation and approval of their annual procurement program
1,the active involvement of the alumnus should be tapped by the dean and the student the alumnus could provide strong support in term of funding and information base for the student
1,research on the employability and demand analysis for graduate can be initiate by the combine effort of student with the guidance and support of the dean and the member of the faculty
1,constant dialogue between the dean the faculty and the student may be initiate in order to foster and build up open line of communication among them thereby identify worthy project and activity for the program and the college
