Level,Recommendations
1,more educational occupational and social information may be provide to student
1,additional guidance counselor may be designate from among the faculty member to cater to the need of the student
1,evaluation of allcocurricular and extracurricular activity need to be do to determine the strength and weakness of the program
1,document file in each folder need to be label properly
1,picture of student activity may be label properly indicate the name of the activity date and the person involves in the activity
