Level,Recommendations
psv,encourage faculty member to finish their master degree
psv,orientation program be to be held for newly hire employee and faculty member
psv,inservice training for faculty member should be regularly held say once every semester
psv,update syllabus to include more recent reference and topic among others also include the semester and school year when the syllabus be prepared
psv,faculty member be encourage to prepare instructional material and if possible they must be copyright if they will be sell to student they must be course through an office or any entity in the institution where it can be part of the income generate project of the department if there is still no_entity or office to do this the mmsu can look into other college and university who be already do this
psv,a mechanism can also be devise to monitor the attendance of faculty member eg a logbook can be design to properly monitor the attendance of the faculty member in their class
psv,properly classify and arrange document accord to benchmark statement of the survey instrument package the document in a manner that can be look into easily
psv,encourage faculty member to attend seminarstraining etc to hone far their teach capability
psv,attach picture that prove activity participate in by the faculty member eg extension activity faculty gathering and other activity etc
