Level,Recommendations
3,a substitution mechanism to fill in the leaf of absence vacancy that occur during the school year to avoid interruption of class is suggest
3,a clear and definite policy to fairly compensate faculty member conduct research and extension should be establish
3,observance of the exist guideline for teach load and number of preparation of faculty member to give way for quality instruction and other related task may be recommend
3,the list of reference may be review to include book of recent edition currently available in the library
3,production of more material for quality instruction evaluate by the ims committee is want
3,for effective utilization of time schedule for other assignment such as research extension and consultation must be incorporate in each teacher program
3,to maintain a sustainable faculty development program it is suggest that budget allocation be increase
