Level,Recommendations
2,more educational occupational and social information may be provide to student
2,additional guidance counselor may be desanatcd from mong the faculty member to cater to the need of the student
2,evaluation of all cocurricular ar indertaken to and extracurricular activity have to be undertaken to determine the strength and weakness of the program
2,documentation of all student activity is highly recommend
2,picture may be label properly indicate the name of the activit date and the person involve in the activity
2,document file in each folder have to be classify and label properly
