Level,Recommendations
4,the unserviceable equipment which be still kept in the laboratory room need to be dispose to maximize the use of the area
4,calibration of the equipment may be do by skilled technician from dost if the supplier of the specific equipment is not_available
4,the inventory of laboratory equipment be not_properly document such as date inventory be conduct who conduct and no_signature
4,the shower with washer room may immediately be instal to make it available in time of emergency
4,put signage that directs the location of laboratory facility and other installation and label each equipment aside from glue property sticker for proper identification
