Level,Recommendations
3,faculty members shall be encouraged to develop instructional materials like books manuals and modules in their area of specialization giving of financial assistance to cover the production cost may be considered
3,faculty members who have written books shall secure isbn for their instructional material
3,the creation of a textbook committee which will evaluate the books to be used by the faculty and students in the different subject areas may be done
3,purchase of additional instructional media such as overhead projectors lcd to enhance teachinglearning process should be given priority
3,the number of hours intended for research extension consultation and other assigned task should be reflected in the workload aside from the subject assignment of the faculty
3,faculty shall be encouraged to present paper not_only in regional and national but also in the international fora and conferences
3,faculty shall be encouraged to write and publish paper in reflected journals
3,a more systematic and organized preparation of accreditation documents for the program should be observed
