Level,Recommendations
3,researches on student needs employability and demand analysis of graduates and effectiveness of the implementation of student activities are encouraged
3,a more active alumni association is imperative hence shall be strengthened
3,for a more responsive guidance services accreditedlicensed guidance counselors can be hired to better service the students
3,budget for student development can be reviewed to allow greater flexibility in rendering student services and in conducting student activities
3,linkages with industries government and private entities shall be strengthened in orderto identify more employment opportunities for graduates
3,since results and feedbacks will be the bases for improved student services regular monitoring and evaluation of activities shall be continuously conducted
3,enrolment campaigns are encouraged to increase enrolment
