Level,Recommendations
4,regularly updating the syllabi with inclusion of more references that are of more recent editions is suggested
4,professional subjects should be handled by teachers with graduate degrees in economics
4,changing the course name from bs economics to bsba economics may be considered it is only the latter that has a cmo setting the standards for the course this may hopefully arrest the decline of enrollment in the course
4,aside from thesis writing onthejob training practicum other work related activities may be included in the curriculum for enhanced learning outcomes
4,participation of industry practitioners and other stake olders in curriculum revision and enrichment to ensure a close match between the students training and the demands of the jobs they will soon occupy may be considered
