Level,Recommendations
1,the workload of the faculty may indicate not_only his teaching assignment but also his schedule of his related tasks like extension research production consultation and administrative work
1,the syllabi may be enriched with varied strategies teaching aids or equipment they may also be signed dated and may follow the common format acceptable to all
1,the facultycore or not_may be encouraged to conduct their researches which results may be basis to improve instruction
1,narrative reports may be written to record committee proceedings seminar and training attended echoseminars conducted and the minutes of meetings kept to serve as reference
1,in case a faculty is absent a notice of substitution may immediately be issued to a vacant faculty to take over the class so learning may continue the substitute may be rewarded a service credit as an incentive
