Level,Recommendations
2,researches on student needs employability and demand analysis of graduates and effectiveness of the implementation of student activities are encouraged
2,a more active alumni association is imperative hence shall be strengthened
2,for a more responsive guidance services accreditedlicensed guidance counselors can be hired to better serve the students
2,budget for student development can be reviewed to allow greater flexibility in rendering student services and conduct of student activities
2,linkages with industries government and private entities shall be strengthened in order to identify more employment opportunities for graduates
2,since results and feedbacks will be the bases for improved student services regular monitoring and evaluation of activities shall be continuously conducted
