Level,Recommendations
psv,all extension activities should be properly planned following the guidelines stated in the manual of operations for extension
psv,full implementation of extension program must be sustained and conducted over a certain period of time to achieve the desired effects
psv,a system of monitoring the extension activities must be devised to suit the needs of the program
psv,there must be a regular evaluation of the extension activities and all the persons involved in the program
psv,all extension activities should be documented from the panning stage to the publication of the entire program showcasing the results of the transfer of technology to the target clientele
psv,documents exhibited for accreditation should be limited to those that are pertinent to the area evaluated
