Level,Recommendations
2,team highly recommends faculty counterpart attach onlu pertinent support document order comprehensive wellpackaged documentation
2,student not_be neglect policy planning activity instution college specifically policy directly affect
2,filing document record management office wellorganized systematic order could easily found retrieve need
2,maintain standard institution team recommends different specific guideline policy strictly observe implement monitores realize
2,budget allows team recommends college provide qualify fulltime laboratory technician custodian manage maintain equipment
2,short longterm development plan monitor evaluate
2,varied social activity regularly strengthen harmonious work relationship mmsu family
2,college must provide specific budget allocation operation
2,faculty honorarium excess teach load include budget preparation could release time
