Level,Recommendations
psv,document properly classify systematically arrange package label ease evaluation
psv,increase sustain participation faculty member research activity along field specialization
psv,linkagesconsortia agency invite productive exchange quality output aside funding derive would program survey establish linkage strengthen exist one
psv,conduct local seminar along thesisresearch write highly recommend come netter research output
psv,conduct research forum college level include fund personally highly recommend
