Level ,Recommendations
1,sustain projectsactivities conduct monitoring evaluation begin completion
1,include vmgos organizational structure document
1,semipermanent big poster preferably tarpaulin strategic place wider dissemination
1,motivation followup lecture periodically conduct
1,periodic monitoring project give faculty
1,since extension projec cbea dura dissemination assistance cover adopt beneficiary
1,consider high soft loan
1,ensure benefit extension program enjoy wide number recipient
