Level,Recommendations
4,institution consider revisit enhance mmsu code integrate new provision attune challenge globalization aean integration towards attainment vision goal objective
4,college encourage establish international linkage networking faculty member engage professional development
4,hire faculty encourage pursue advanced education provision scholarship program possibly send recognize accredit university abroad budget warrant
4,performance evaluation result disseminate academic personnel staff provide copy rating basis improve performance efficient effective delivery service
4,good practice improvement performance academic personnel towards attainment university vision target objective sustain
