Level,Recommendations
3,faculty develop instructional material consider ched obe format syllabus instruction
3,tracer study feedback employer consider evaluate performance graduate commendable
3,syllabus program update reference ten year back time utilization
3,distribution list course syllabus indicate name student date receipt esignature remark show mvle platform
3,evaluation report towards effective result training maybe collate regularly
3,faculty introduce platform student show video student perform apply practical laboratory skill home
3,management consider increase amount p peso topnotchers board examination motivate student chemical engineering program best increase passing percentage board examination result possibly national passing percentage produce topnotchers great honor university true indicator quality excellence
3,employability graduate one concrete measure determine quality student institution produce relative faculty consider fielding survey form different apps get update information
