Level,Recommendations
1,team reiterates recommendation preliminary survey team adopt benchmarking survey inclusion survey environmental endowment target community
1,team also reiterates recommendation team prepare long term sustainable extension program department focus dissemination new technology new knowledge field physical therapy commercialization research result creation enterprise
1,team recommends organization pool health care expertspractitioners help conduct extension activity department
1,team also recommends preparation tool quantify improvement life community relation return investment internal rate return
1,team far suggests source additional funding source service conduct continuously sustain financial stability target clientelebeneficiaries
