Level,Recommendations
1,ensure safe keep donate laboratory equipment memorandum receipt issue end user
1,administration consider schedule conduct training repair maintenance high end equipmentapparatus
1,administration prioritize construction additional stock room supply
1,maximize efficiency state art equipment apparatus proper handle safekeeping necessary
1,modification laboratory room might take consideration accommodate additional equipment laboratory work instruction
1,repair exist cabinet consider safe keep material apparatus laboratory room
