Level,Recommendations
3,The building floor .plan may be displayed or posted in conspicuous places in the buildings.
3,Signages of entry and exit in the first floor and second floor of the buildings may be made available and visible.
3,More fire extinguishers may be mounted and be accessible in the building. Firefighting equipment like fire hose may be made available in the building of the college.
3,Pest control inspection may be done periodically.
3,Trash bins may be more available in the corridors and classrooms. Anti-littering campaign. may be implemented to maintain cleanliness of the classrooms and surroundings.
3,Pathway intended for persons with disability (PWD) may have the railings.
3,Students may be given responsibility in the maintenance and beautification of classrooms.
3,Lounge in the faculty rooms may be made available.