Level,Recommendations
3,"To  prioritize  the  training  programs  to  be  undertaken  in  each  target clientele/barangay, Training Needs Assessment should be first conducted."
3,"After the evaluation made during each extension activity conducted, this should be analyzed for possible replanning. "
3,All extension activities should be properly documented.
3,Faculty members in the college conducting extension servicest should be deloaded or given equivalent teaching load to encourage them to do more extension services for the benefit of target clientele.
3,The extension office should be equipped with the needed equipment such ase set of computer with printer for the documentation and filing of need information.
3,A regular office clerk should be hired to help man the extension office to perform clerical job and assist in the implementation of extension activities.