Level,Recommendations
2,"There is an existing housing facilities for students, faculty and staffs but needs repair and additional amenities."
2,"    Additional storage facilities may be provided for athletics, sports and other curricular training equipment and be strategically located."
2,The administration may secure certificate of occupancy for its buildings and be made visible.
2, The fire escape plan be visibly posted in all buildings for the safety of all stakeholders.
2,     The administration may consider the refurbishment of the canteen/cafeteria facilities to provide better services to clientele.
2,Installment of fire alarm system may be done as soon as possible.