Level,Recommendations
PSV,Documents for exhibit should be packaged systematically.
PSV,There documents should fall within the evaluation period.
PSV,Activities related to different programs and courses for easy classification to where they belong be identified.
PSV,Devise tools for monitoring and evaluation for full implementation and sustainability.
PSV,Add some staff or faculty line-up for the regular monitoring of extension activities.
PSV,Concerned faculty have to source out additional funds for possible expansion of future extension activities.